status,type_of_publication,year,title,authors,item_info,url_text,url_code,url_slides,url_youtube
Published,Article,2022,"High prevalence of asymptomatic Plasmodium falciparum malaria in Makenene, a locality in the forest-savannah transition zone, Centre Region of Cameroon","Djoufounna, J., Mayi, M.P.A.,  Bamou, R., **Foyet, J.V.**, Tabue, R.,  Lontsi-Demano, M., Achu-Fosah, D., Antonio-Nkondjio, C., and Tchuinkam, T.",Current Research in Parasitology and Vector-Borne Diseases,https://doi.org/10.1016/j.crpvbd.2022.100104,NA,NA,NA
Published,Article,2024,"Uptake of intermittent preventive treatment of malaria in pregnancy and risk factors for maternal anaemia and low birthweight among HIV-negative mothers in Dschang, West region of Cameroon: a cross sectional study","Simo Kamga, S.L., Mbulli, I.A., Ngangnang, G.R., Ulucesme, M.C., Keptcheu, L.T.D., Keming, E.M., Tchuenkam, V.P.K., **Foyet, J.V.**, Aktas, M., Noubom, M., and Payne, V.K.",Malaria Journal,https://doi.org/10.1186/s12936-023-04816-8,NA,NA,NA
Published,Article,2024,"Promoting the potabilisation of drinking water at home using local materials as an alternative solution for combating water-borne diseases: socio-economic feasibility study in Dschang, West Cameroon","Ntangmo Tsafack, H., Djoko, G.R.P., Wandji Kwekap, J., Wamba, F., **Foyet, J.V.**, Temgoua, E.",World Water Policy, https://doi.org/10.1002/wwp2.12176,,,
Submitted,Article,2024,"A five years malaria frequency: a result of a retrospective study in Makenene health area in a forest-savannah transition ecozone, Centre-Cameroun","Djoufounna, J., Bamou, R., **Foyet, J.V.**, Ningahi, L.G., Mayi, M.P.A., Antonio-Nkondjio, C., and Tchuinkam, T.",Parasite Epidemiology and Control,,,,
Published,Article,2024,Survival and growth of *M. perstans* larvae in a human colon carcinoma cell line-based in vitro culture,"Gandjui, N.V.T, Fombad, F.F, Kien, C.A., Ebai, R., Esofi, F., Ntuh, A.N., Ouam, E., Chunda, V.C., Ekanya, R., Nietcho, F.N., **Foyet, J.V.**, Nchang, L.C., Magha, C., Njouendou, A.J., Enyong, P., Hoerauf, A.,  Wanji, S., Ritter, M.",Experimental Parasitology,https://doi.org/10.1016/j.exppara.2024.108822,,,
